------------------------------------------------------------
[START] 
2026-01-24 21:24:25,261 - INFO - ==================================================
2026-01-24 21:24:25,261 - INFO - Motion Detection Video Processor Started
2026-01-24 21:24:25,261 - INFO - ==================================================
2026-01-24 21:24:25,261 - INFO - [SETUP] Data directory ready: /Users/aneesh/Desktop/coding/CCTV/motion/data
2026-01-24 21:24:25,261 - INFO - [CLEANUP] Starting cleanup of old files
2026-01-24 21:24:25,262 - INFO - [CLEANUP] Deleted 0 old file(s)
2026-01-24 21:24:25,262 - INFO - [FETCH] Fetching motion events between 12:00 AM to 7:00 AM on 2026-01-24
2026-01-24 21:24:25,287 - WARNING - [FETCH] No motion events found
[END]    ✅

------------------------------------------------------------
[START] 2026-01-24T21:26:21+0530
2026-01-24 21:26:22,032 - INFO - ==================================================
2026-01-24 21:26:22,032 - INFO - Motion Detection Video Processor Started
2026-01-24 21:26:22,032 - INFO - ==================================================
2026-01-24 21:26:22,033 - INFO - [SETUP] Data directory ready: /Users/aneesh/Desktop/coding/CCTV/motion/data
2026-01-24 21:26:22,033 - INFO - [CLEANUP] Starting cleanup of old files
2026-01-24 21:26:22,033 - INFO - [CLEANUP] Deleted 0 old file(s)
2026-01-24 21:26:22,033 - INFO - [FETCH] Fetching motion events between 12:00 AM to 7:00 AM on 2026-01-24
2026-01-24 21:26:22,082 - WARNING - [FETCH] No motion events found
[END]   2026-01-24T21:26:22+0530 ✅

------------------------------------------------------------
[START] 2026-01-24T21:29:50+0530
2026-01-24 21:29:50,750 - INFO - ==================================================
2026-01-24 21:29:50,750 - INFO - Motion Detection Video Processor Started
2026-01-24 21:29:50,750 - INFO - ==================================================
2026-01-24 21:29:50,750 - INFO - [SETUP] Data directory ready: /Users/aneesh/Desktop/coding/CCTV/motion/data
2026-01-24 21:29:50,750 - INFO - [CLEANUP] Starting cleanup of old files
2026-01-24 21:29:50,751 - INFO - [CLEANUP] Deleted 0 old file(s)
2026-01-24 21:29:50,751 - INFO - [FETCH] Fetching motion events between 12:00 AM to 7:00 AM on 2026-01-24
2026-01-24 21:29:50,774 - WARNING - [FETCH] No motion events found
2026-01-24 21:29:51,614 - INFO - HTTP Request: POST https://api.telegram.org/bot8272732016:AAHIkCQsLxpgTSyE3i-dlJtDVnlaT0p5jW0/sendMessage "HTTP/1.1 200 OK"
2026-01-24 21:29:51,615 - INFO - [TELEGRAM] ✓ Sent to user 8112549574
[END]   2026-01-24T21:29:51+0530 ✅

------------------------------------------------------------
[START] 2026-01-24T21:53:42+0530
2026-01-24 21:53:43,261 - INFO - ==================================================
2026-01-24 21:53:43,261 - INFO - Motion Detection Video Processor Started
2026-01-24 21:53:43,261 - INFO - ==================================================
2026-01-24 21:53:43,262 - INFO - [SETUP] Data directory ready: /Users/aneesh/coding/CCTV/motion/data
2026-01-24 21:53:43,262 - INFO - [CLEANUP] Starting cleanup of old files
2026-01-24 21:53:43,262 - INFO - [CLEANUP] Deleted 0 old file(s)
2026-01-24 21:53:43,262 - INFO - [FETCH] Fetching motion events between 12:00 AM to 7:00 AM on 2026-01-24
2026-01-24 21:53:43,301 - WARNING - [FETCH] No motion events found
2026-01-24 21:53:44,249 - INFO - HTTP Request: POST https://api.telegram.org/bot8272732016:AAHIkCQsLxpgTSyE3i-dlJtDVnlaT0p5jW0/sendMessage "HTTP/1.1 200 OK"
2026-01-24 21:53:44,251 - INFO - [TELEGRAM] ✓ Sent to user 8112549574
[END]   2026-01-24T21:53:44+0530 ✅

------------------------------------------------------------
[START] 2026-01-24T22:28:38+0530
2026-01-24 22:28:40,171 - INFO - ==================================================
2026-01-24 22:28:40,172 - INFO - Motion Detection Video Processor Started
2026-01-24 22:28:40,172 - INFO - ==================================================
2026-01-24 22:28:40,172 - INFO - [SETUP] Data directory ready: /Users/aneesh/coding/CCTV/motion/data
2026-01-24 22:28:40,172 - INFO - [CLEANUP] Starting cleanup of old files
2026-01-24 22:28:40,173 - INFO - [CLEANUP] Deleted 0 old file(s)
2026-01-24 22:28:40,173 - INFO - [FETCH] Fetching motion events between 12:00 AM to 7:00 AM on 2026-01-24
2026-01-24 22:28:40,867 - WARNING - [FETCH] No motion events found
2026-01-24 22:28:42,594 - INFO - HTTP Request: POST https://api.telegram.org/bot8272732016:AAHIkCQsLxpgTSyE3i-dlJtDVnlaT0p5jW0/sendMessage "HTTP/1.1 200 OK"
2026-01-24 22:28:42,597 - INFO - [TELEGRAM] ✓ Sent to user 8112549574
[END]   2026-01-24T22:28:42+0530 ✅

------------------------------------------------------------
[START] 2026-01-25T07:05:00+0530
2026-01-25 07:05:00,933 - INFO - ==================================================
2026-01-25 07:05:00,933 - INFO - Motion Detection Video Processor Started
2026-01-25 07:05:00,933 - INFO - ==================================================
2026-01-25 07:05:00,933 - INFO - [SETUP] Data directory ready: /Users/aneesh/coding/CCTV/motion/data
2026-01-25 07:05:00,933 - INFO - [CLEANUP] Starting cleanup of old files
2026-01-25 07:05:00,934 - INFO - [CLEANUP] Deleted 0 old file(s)
2026-01-25 07:05:00,934 - INFO - [FETCH] Fetching motion events between 12:00 AM to 7:00 AM on 2026-01-25
2026-01-25 07:05:00,960 - INFO - [FETCH] Retrieved 6 motion event(s)
2026-01-25 07:05:00,960 - INFO - [FETCH] Motion detected at 00:00:03.349795
2026-01-25 07:05:00,960 - INFO - [FETCH] Motion detected at 00:01:35.656053
2026-01-25 07:05:00,960 - INFO - [FETCH] Motion detected at 00:13:42.320103
2026-01-25 07:05:00,960 - INFO - [FETCH] Motion detected at 05:36:59.917032
2026-01-25 07:05:00,960 - INFO - [FETCH] Motion detected at 06:47:09.473395
2026-01-25 07:05:00,961 - INFO - [FETCH] Motion detected at 06:55:25.785636
2026-01-25 07:05:00,961 - INFO - [MERGE] Starting to merge nearby motion events
2026-01-25 07:05:00,961 - INFO - [MERGE] Motion event: 00:00:03.349795 - Duration: 2.54 minutes
2026-01-25 07:05:00,961 - INFO - [MERGE] Motion event: 00:13:42.320103 - Duration: 1.00 minutes
2026-01-25 07:05:00,961 - INFO - [MERGE] Motion event: 05:36:59.917032 - Duration: 1.00 minutes
2026-01-25 07:05:00,961 - INFO - [MERGE] Motion event: 06:47:09.473395 - Duration: 1.00 minutes
2026-01-25 07:05:00,961 - INFO - [MERGE] Motion event: 06:55:25.785636 - Duration: 1.00 minutes
2026-01-25 07:05:00,961 - INFO - [MERGE] Total merged motion events: 5
2026-01-25 07:05:00,961 - INFO - [DOWNLOAD] Starting video downloads
2026-01-25 07:05:00,961 - INFO - [DOWNLOAD] (1/5) Fetching video for motion at 23:59:03.349795
2026-01-25 07:05:05,603 - INFO - [DOWNLOAD] ✓ Video saved: 1.mp4 (83.21 MB)
2026-01-25 07:05:05,603 - INFO - [DOWNLOAD] (2/5) Fetching video for motion at 00:12:42.320103
2026-01-25 07:05:11,162 - INFO - [DOWNLOAD] ✓ Video saved: 2.mp4 (66.53 MB)
2026-01-25 07:05:11,162 - INFO - [DOWNLOAD] (3/5) Fetching video for motion at 05:35:59.917032
2026-01-25 07:05:15,149 - INFO - [DOWNLOAD] ✓ Video saved: 3.mp4 (49.93 MB)
2026-01-25 07:05:15,149 - INFO - [DOWNLOAD] (4/5) Fetching video for motion at 06:46:09.473395
2026-01-25 07:05:15,616 - INFO - [DOWNLOAD] ✓ Video saved: 4.mp4 (49.95 MB)
2026-01-25 07:05:15,616 - INFO - [DOWNLOAD] (5/5) Fetching video for motion at 06:54:25.785636
2026-01-25 07:05:16,164 - INFO - [DOWNLOAD] ✓ Video saved: 5.mp4 (66.58 MB)
2026-01-25 07:05:16,165 - INFO - ==================================================
2026-01-25 07:05:16,165 - INFO - [SUMMARY] Download complete: 5 successful, 0 failed
2026-01-25 07:05:16,165 - INFO - ==================================================
2026-01-25 07:05:16,165 - INFO - [TELEGRAM] Sending motion summary
2026-01-25 07:05:17,040 - INFO - HTTP Request: POST https://api.telegram.org/bot8272732016:AAHIkCQsLxpgTSyE3i-dlJtDVnlaT0p5jW0/sendMessage "HTTP/1.1 200 OK"
2026-01-25 07:05:17,041 - INFO - [TELEGRAM] ✓ Sent to user 8112549574
2026-01-25 07:05:17,043 - INFO - Motion Detection Video Processor Complete
[END]   2026-01-25T07:05:17+0530 ✅

